{
  "$schema": "https://raw.githubusercontent.com/jordachmakaya/index-ai/v1.0-rc2/schema/v1/index-ai.schema.json",
  "spec_version": "1.0-rc2",
  "manifest_version": 2,
  "identity": {
    "name": "index-ai documentation",
    "description": "The index-ai open specification proposal: specification, quickstart, llms.txt comparison, and changelog. Published on GitHub Pages under the /index-ai/ sub-path.",
    "domain": "jordachmakaya.github.io",
    "category": ["documentation", "specification"],
    "language": ["en"]
  },
  "publisher": {
    "name": "index-ai project",
    "role": "official-docs"
  },
  "freshness": {
    "content_updated_at": "2026-08-12T14:05:22Z",
    "manifest_generated_at": "2026-08-12T14:05:22Z"
  },
  "access": {
    "agent_index": "/index-ai/agent-index.json",
    "fetch_allowlist": ["https://raw.githubusercontent.com"]
  },
  "llm_instructions": "Normative specification and schema links target the immutable v1.0-rc2 release. Other navigation links may point to project and external resources."
}
